{
 "meta": {
  "date": "2026-10-15",
  "reviewed_patients": 8187,
  "audited_projects": 20,
  "projects": 20,
  "analysis_cohorts": 18,
  "discovery_cohorts": 17,
  "benchmark_cohorts": 1,
  "treated_reference": false,
  "integrated_who_diagnosis_adjudicated": false
 },
 "projects": {
  "BLCA": {
   "analysis_cohort": "BLCA",
   "role": "discovery",
   "reviewed_patients": 404,
   "histology_reviewed": false,
   "assay_qc": {
    "total": 401,
    "rna": 395,
    "met": 401,
    "paired": 395,
    "rna_only": 0,
    "met_only": 6
   },
   "after_patient_screen": {
    "total": 388,
    "rna": 382,
    "met": 388,
    "paired": 382,
    "rna_only": 0,
    "met_only": 6
   },
   "selected_analysis": {
    "total": 388,
    "rna": 382,
    "met": 388,
    "paired": 382,
    "rna_only": 0,
    "met_only": 6
   },
   "dispositions": {
    "pass_annotation_screen": 388,
    "known_treatment_exclusion": 11,
    "diagnosis_identity_or_episode_exclusion_hold": 2
   },
   "normal": {
    "rna_he_before": 19,
    "rna_he_after": 19,
    "rna_he_met_after": 17,
    "in_active_scope": true,
    "withheld": [],
    "context": {
     "target_project_donor": 19
    },
    "context_met": {
     "target_project_donor": 17
    },
    "outside_cohort": []
   },
   "label_conflicts": []
  },
  "BRCA": {
   "analysis_cohort": "BRCA",
   "role": "discovery",
   "reviewed_patients": 1085,
   "histology_reviewed": false,
   "assay_qc": {
    "total": 1085,
    "rna": 1082,
    "met": 778,
    "paired": 775,
    "rna_only": 307,
    "met_only": 3
   },
   "after_patient_screen": {
    "total": 1062,
    "rna": 1060,
    "met": 764,
    "paired": 762,
    "rna_only": 298,
    "met_only": 2
   },
   "selected_analysis": {
    "total": 1062,
    "rna": 1060,
    "met": 764,
    "paired": 762,
    "rna_only": 298,
    "met_only": 2
   },
   "dispositions": {
    "pass_annotation_screen": 1062,
    "diagnosis_identity_or_episode_exclusion_hold": 5,
    "treatment_unknown_hold": 10,
    "known_treatment_exclusion": 8
   },
   "normal": {
    "rna_he_before": 98,
    "rna_he_after": 98,
    "rna_he_met_after": 73,
    "in_active_scope": true,
    "withheld": [],
    "context": {
     "target_project_donor": 98
    },
    "context_met": {
     "target_project_donor": 73
    },
    "outside_cohort": []
   },
   "label_conflicts": []
  },
  "CESC": {
   "analysis_cohort": "CSCC",
   "role": "discovery",
   "reviewed_patients": 302,
   "histology_reviewed": true,
   "assay_qc": {
    "total": 302,
    "rna": 300,
    "met": 302,
    "paired": 300,
    "rna_only": 0,
    "met_only": 2
   },
   "after_patient_screen": {
    "total": 301,
    "rna": 299,
    "met": 301,
    "paired": 299,
    "rna_only": 0,
    "met_only": 2
   },
   "selected_analysis": {
    "total": 249,
    "rna": 248,
    "met": 249,
    "paired": 248,
    "rna_only": 0,
    "met_only": 1
   },
   "dispositions": {
    "pass_annotation_screen": 301,
    "diagnosis_identity_or_episode_exclusion_hold": 1
   },
   "normal": {
    "rna_he_before": 3,
    "rna_he_after": 3,
    "rna_he_met_after": 3,
    "in_active_scope": true,
    "withheld": [],
    "context": {
     "target_project_donor": 3
    },
    "context_met": {
     "target_project_donor": 3
    },
    "outside_cohort": [
     "TCGA-FU-A3EO"
    ],
    "outside_cohort_histology": {
     "TCGA-FU-A3EO": "Adenocarcinoma"
    }
   },
   "label_conflicts": [
    {
     "patient": "TCGA-DG-A2KK",
     "gdc": "Adenocarcinoma, NOS",
     "publication": "Squamous",
     "stratum": "Squamous",
     "selected": true
    },
    {
     "patient": "TCGA-EA-A5ZF",
     "gdc": "Squamous cell carcinoma, NOS",
     "publication": "Adenosquamous",
     "stratum": "Adenosquamous",
     "selected": false
    },
    {
     "patient": "TCGA-HM-A6W2",
     "gdc": "Squamous cell carcinoma, NOS",
     "publication": "Adenosquamous",
     "stratum": "Adenosquamous",
     "selected": false
    }
   ]
  },
  "COAD": {
   "analysis_cohort": "CRC",
   "role": "discovery",
   "reviewed_patients": 443,
   "histology_reviewed": false,
   "assay_qc": {
    "total": 443,
    "rna": 441,
    "met": 287,
    "paired": 285,
    "rna_only": 156,
    "met_only": 2
   },
   "after_patient_screen": {
    "total": 427,
    "rna": 425,
    "met": 281,
    "paired": 279,
    "rna_only": 146,
    "met_only": 2
   },
   "selected_analysis": {
    "total": 427,
    "rna": 425,
    "met": 281,
    "paired": 279,
    "rna_only": 146,
    "met_only": 2
   },
   "dispositions": {
    "pass_annotation_screen": 427,
    "diagnosis_identity_or_episode_exclusion_hold": 7,
    "known_treatment_exclusion": 5,
    "treatment_unknown_hold": 4
   },
   "normal": {
    "rna_he_before": 37,
    "rna_he_after": 37,
    "rna_he_met_after": 17,
    "in_active_scope": true,
    "withheld": [],
    "context": {
     "target_project_donor": 36,
     "non_target_or_uncertain_or_recurrent_donor": 1
    },
    "context_met": {
     "target_project_donor": 17
    },
    "outside_cohort": []
   },
   "label_conflicts": []
  },
  "ESCA": {
   "analysis_cohort": "ESCC",
   "role": "discovery",
   "reviewed_patients": 174,
   "histology_reviewed": true,
   "assay_qc": {
    "total": 174,
    "rna": 173,
    "met": 174,
    "paired": 173,
    "rna_only": 0,
    "met_only": 1
   },
   "after_patient_screen": {
    "total": 174,
    "rna": 173,
    "met": 174,
    "paired": 173,
    "rna_only": 0,
    "met_only": 1
   },
   "selected_analysis": {
    "total": 90,
    "rna": 90,
    "met": 90,
    "paired": 90,
    "rna_only": 0,
    "met_only": 0
   },
   "dispositions": {
    "pass_annotation_screen": 174
   },
   "normal": {
    "rna_he_before": 10,
    "rna_he_after": 10,
    "rna_he_met_after": 8,
    "in_active_scope": true,
    "withheld": [],
    "context": {
     "target_project_donor": 10
    },
    "context_met": {
     "target_project_donor": 8
    },
    "outside_cohort": [
     "TCGA-IC-A6RE",
     "TCGA-L5-A43C",
     "TCGA-L5-A4OF",
     "TCGA-L5-A4OG",
     "TCGA-L5-A4OJ",
     "TCGA-L5-A4OO",
     "TCGA-L5-A4OQ",
     "TCGA-L5-A4OR"
    ]
   },
   "label_conflicts": []
  },
  "GBM": {
   "analysis_cohort": "GLIOMA",
   "role": "classification-benchmark",
   "reviewed_patients": 247,
   "histology_reviewed": true,
   "assay_qc": {
    "total": 242,
    "rna": 154,
    "met": 139,
    "paired": 51,
    "rna_only": 103,
    "met_only": 88
   },
   "after_patient_screen": {
    "total": 225,
    "rna": 141,
    "met": 130,
    "paired": 46,
    "rna_only": 95,
    "met_only": 84
   },
   "selected_analysis": {
    "total": 225,
    "rna": 141,
    "met": 130,
    "paired": 46,
    "rna_only": 95,
    "met_only": 84
   },
   "dispositions": {
    "pass_annotation_screen": 225,
    "known_treatment_exclusion": 3,
    "diagnosis_identity_or_episode_exclusion_hold": 10,
    "treatment_unknown_hold": 4
   },
   "normal": {
    "rna_he_before": 5,
    "rna_he_after": 5,
    "rna_he_met_after": 1,
    "in_active_scope": true,
    "withheld": [],
    "context": {
     "normal_only_donor_primary_diagnosis_unreported": 5
    },
    "context_met": {
     "normal_only_donor_primary_diagnosis_unreported": 1
    },
    "outside_cohort": []
   },
   "label_conflicts": []
  },
  "HNSC": {
   "analysis_cohort": "HNSC",
   "role": "discovery",
   "reviewed_patients": 522,
   "histology_reviewed": false,
   "assay_qc": {
    "total": 522,
    "rna": 514,
    "met": 522,
    "paired": 514,
    "rna_only": 0,
    "met_only": 8
   },
   "after_patient_screen": {
    "total": 514,
    "rna": 506,
    "met": 514,
    "paired": 506,
    "rna_only": 0,
    "met_only": 8
   },
   "selected_analysis": {
    "total": 514,
    "rna": 506,
    "met": 514,
    "paired": 506,
    "rna_only": 0,
    "met_only": 8
   },
   "dispositions": {
    "pass_annotation_screen": 514,
    "diagnosis_identity_or_episode_exclusion_hold": 4,
    "known_treatment_exclusion": 4
   },
   "normal": {
    "rna_he_before": 43,
    "rna_he_after": 39,
    "rna_he_met_after": 20,
    "in_active_scope": true,
    "withheld": [
     "TCGA-CV-7406",
     "TCGA-CV-7416",
     "TCGA-CV-7437",
     "TCGA-CV-7440"
    ],
    "context": {
     "target_project_donor": 39
    },
    "context_met": {
     "target_project_donor": 20
    },
    "outside_cohort": []
   },
   "label_conflicts": []
  },
  "KIRC": {
   "analysis_cohort": "KIRC",
   "role": "discovery",
   "reviewed_patients": 516,
   "histology_reviewed": false,
   "assay_qc": {
    "total": 516,
    "rna": 515,
    "met": 312,
    "paired": 311,
    "rna_only": 204,
    "met_only": 1
   },
   "after_patient_screen": {
    "total": 494,
    "rna": 493,
    "met": 306,
    "paired": 305,
    "rna_only": 188,
    "met_only": 1
   },
   "selected_analysis": {
    "total": 494,
    "rna": 493,
    "met": 306,
    "paired": 305,
    "rna_only": 188,
    "met_only": 1
   },
   "dispositions": {
    "pass_annotation_screen": 494,
    "treatment_unknown_hold": 6,
    "known_treatment_exclusion": 12,
    "diagnosis_identity_or_episode_exclusion_hold": 4
   },
   "normal": {
    "rna_he_before": 71,
    "rna_he_after": 71,
    "rna_he_met_after": 23,
    "in_active_scope": true,
    "withheld": [],
    "context": {
     "target_project_donor": 70,
     "non_target_or_uncertain_or_recurrent_donor": 1
    },
    "context_met": {
     "target_project_donor": 22,
     "non_target_or_uncertain_or_recurrent_donor": 1
    },
    "outside_cohort": []
   },
   "label_conflicts": []
  },
  "KIRP": {
   "analysis_cohort": "KIRP",
   "role": "discovery",
   "reviewed_patients": 280,
   "histology_reviewed": false,
   "assay_qc": {
    "total": 280,
    "rna": 279,
    "met": 267,
    "paired": 266,
    "rna_only": 13,
    "met_only": 1
   },
   "after_patient_screen": {
    "total": 275,
    "rna": 274,
    "met": 262,
    "paired": 261,
    "rna_only": 13,
    "met_only": 1
   },
   "selected_analysis": {
    "total": 275,
    "rna": 274,
    "met": 262,
    "paired": 261,
    "rna_only": 13,
    "met_only": 1